UF,Sigla,Pedido,Depósito,Título,Linguagem,Campo de Aplicação,Tipo Programa,Nome do Titular:,Nome do Autor,Nome do Procurador:,,
Ceará,IFCE,BR 51 2022 000150 0,26/01/2022,Desenvolvimento de sistema de telemedicina inteligente para psiquiatria,FRAMEWORK / OUTROS / PYTHON,SD-08,TC-03,"INSTITUTO FEDERAL DE EDUCAÇÃO, CIÊNCIA E TECNOLOGIA DO CEARÁ / KIRON TECNOLOGIA E SERVICOS MEDICOS LTDA / M2C CONSULTORIA E SOLUCOES EMPRESARIAL EIRELI", ADAILTON DOS SANTOS HOLANDA / AUZUIR RIPARDO DE ALEXANDRIA / EDSON CAVALCANTI NETO / GABRIEL TAVARES DE MELO FREITAS / ISAC DO NASCIMENTO LIRA / LEONARDO AUGUSTO NEGREIROS PARENTE CAPELA SAMPAIO / MARCELLO CARVALHO DOS REIS,-,,
Ceará,IFCE,BR 51 2021 003086 9,15/12/2021,Plataforma de Auditoria Fiscal Baseada em Motor de Inferência de Regras,JAVA, AD-09 / FN-01," AP-04 , AP-05"," GOLDEN TECHNOLOGIA LTDA / INSTITUTO FEDERAL DE EDUCAÇÃO, CIÊNCIA E TECNOLOGIA DO CEARÁ / ITEGRA TECNOLOGIA LTDA",AMANDA CONRADO PEREIRA / DARIELSON ARAÚJO DE SOUZA / RONALDO FERNANDES RAMOS / THUAN SARAIVA NABUCO,-,,
Ceará,IFCE,BR 51 2021 003057 5,09/12/2021,Sistema de rebalanceamento de estoque baseado em aprendizado de máquinas, OUTROS,AD-08,IA-01,"GERA3 SISTEMAS E AUTOMAÇÃO DE GESTÃO EIRELI / INSTITUTO FEDERAL DE EDUCAÇÃO, CIÊNCIA E TECNOLOGIA DO CEARÁ",AJALMAR REGO DA ROCHA NETO / LUCAS SILVA DE SOUSA / MARINA BRASIL GRADVOHL / THALYSON GOMES NEPOMUCENO DA SILVA / VICTOR RIBEIRO PRATA / WELLINGTON DANTAS DE ALMEIDA,-,,
Ceará,IFCE,BR 51 2021 003056 7,09/12/2021,Sistema de recomendação de item de produto baseado em filtragem colaborativa, OUTROS,AD-10,IA-01,"GERA3 SISTEMAS E AUTOMAÇÃO DE GESTÃO EIRELI / INSTITUTO FEDERAL DE EDUCAÇÃO, CIÊNCIA E TECNOLOGIA DO CEARÁ",AJALMAR REGO DA ROCHA NETO / LUCAS SILVA DE SOUSA / MARINA BRASIL GRADVOHL / THALYSON GOMES NEPOMUCENO DA SILVA / VICTOR RIBEIRO PRATA / WELLINGTON DANTAS DE ALMEIDA,-,,
Ceará,IFCE,BR 51 2021 003055 9,09/12/2021,API de Detecção de Atenção, OUTROS, ED-04,IA-01,"BOUTTI TREINAMENTOS E DESENVOLVIMENTO DE SOFTWARE LTDA - ME / INSTITUTO FEDERAL DE EDUCAÇÃO, CIÊNCIA E TECNOLOGIA DO CEARÁ / SW INFORMÁTICA TREINAMENTOS E SERVIÇOS LTDA",ANTONIO DE BARROS SERRA / CLAUDIO COSTA FORTIER / RONDINELLI MOURA MACHADO,-,,
Ceará,IFCE,BR 51 2021 003054 0,09/12/2021,Sistema H-Teaching (Portal de Vídeos), OUTROS, ED-04,IA-01,"BOUTTI TREINAMENTOS E DESENVOLVIMENTO DE SOFTWARE LTDA - ME / INSTITUTO FEDERAL DE EDUCAÇÃO, CIÊNCIA E TECNOLOGIA DO CEARÁ / SW INFORMÁTICA TREINAMENTOS E SERVIÇOS LTDA",ANTONIO DE BARROS SERRA / CLAUDIO COSTA FORTIER / RONDINELLI MOURA MACHADO,-,,
Ceará,IFCE,BR 51 2021 003053 2,09/12/2021,API de Reconhecimento de Emoção, OUTROS, ED-04,IA-01,"BOUTTI TREINAMENTOS E DESENVOLVIMENTO DE SOFTWARE LTDA - ME / INSTITUTO FEDERAL DE EDUCAÇÃO, CIÊNCIA E TECNOLOGIA DO CEARÁ / SW INFORMÁTICA TREINAMENTOS E SERVIÇOS LTDA",ANTONIO DE BARROS SERRA / CLAUDIO COSTA FORTIER / RONDINELLI MOURA MACHADO,-,,
Ceará,IFCE,BR 51 2021 003052 4,09/12/2021,Sistema de gestão e monitoramento de equipamentos de corte e solda em ambiente industrial por Internet das Coisas - i9Solda,JAVA / OUTROS / SQL,IN-05,AT-07,"INSTITUTO FEDERAL DE EDUCAÇÃO, CIÊNCIA E TECNOLOGIA DO CEARÁ / MATHEUS XAVIER ROCHA 60399153314", ANTÔNIO SÁVIO SILVA OLIVEIRA / AUZUIR RIPARDO DE ALEXANDRIA / CARLOS ALBERTO SAMPAIO SALES JUNIOR / DEUSIMAR DE FREITAS MATOS / EDSON CAVALCANTI NETO / FRANCISCO ALAN XAVIER DA MOTA / FRANCISCO JOSÉ PONTES CAVALCANTE / GLENDO DE FREITAS GUIMARÃES / JOAO ISAAC SILVA MIRANDA / JOSÉ VANDO MOREIRA DE OLIVEIRA / JOÃO VIEIRA MACIEL / JÚLIO CÉSAR CAPISTRANO ESTÁCIO / LORENA BRAGA MOURA / MATHEUS XAVIER ROCHA / NILLIA SOUSA DA SILVA / RÔMULO LOPES FRUTUOSO,-,,
Ceará,IFCE,BR 51 2021 002800 7,23/11/2021,Firmware Bandeja Temi,PYTHON, SV-03,AT-03,"INSTITUTO FEDERAL DE EDUCAÇÃO, CIÊNCIA E TECNOLOGIA DO CEARÁ / OK ENERGY, IMPORTACAO E EXPORTACAO LTDA",ANAXÁGORAS MAIA GIRÃO / ARTUR RIBEIRO LUCENA / JOÃO BATISTA BEZERRA FROTA / LUCAS CUNHA DA COSTA VELHO / MIGUEL LEVY SILVA MESQUITA / TOMAZ COSTA SOARES JUNIOR / VINÍCIUS MENEZES MONTE,-,,
Ceará,IFCE,BR 51 2021 002492 3,22/10/2021,FIRMWARE ENDPLORA,C, SM-04,AT-03,"INSTITUTO FEDERAL DE EDUCAÇÃO, CIÊNCIA E TECNOLOGIA DO CEARÁ / SANMINA-SCI DO BRASIL INTEGRATION LTDA", GUILHERME AMADO DELMIRO DE OLIVEIRA / JOACILLO LUZ DANTAS / JOÃO BATISTA BEZERRA FROTA / SAMUEL ALVES GADELHA / THIAGO LEAL MENEZES / TOMAZ COSTA SOARES JUNIOR / VINICIUS OLIVEIRA DA FONSECA / VINÍCIUS MENEZES MONTE,-,,
Ceará,IFCE,BR 51 2021 002491 5,22/10/2021,IHM ENDPLORA, OUTROS, SM-04,AT-03,"INSTITUTO FEDERAL DE EDUCAÇÃO, CIÊNCIA E TECNOLOGIA DO CEARÁ / SANMINA-SCI DO BRASIL INTEGRATION LTDA",GUILHERME AMADO DELMIRO DE OLIVEIRA / JOACILLO LUZ DANTAS / JOÃO BATISTA BEZERRA FROTA / SAMUEL ALVES GADELHA / THIAGO LEAL MENEZES / TOMAZ COSTA SOARES JUNIOR / VINICIUS OLIVEIRA DA FONSECA / VINÍCIUS MENEZES MONTE,-,,
Ceará,IFCE,BR 51 2021 002378 1,07/10/2021,MITS DOPPLER,C,IN-02,TI-01,"INSTITUTO FEDERAL DE EDUCAÇÃO, CIÊNCIA E TECNOLOGIA DO CEARÁ / MOBIT - MOBILIDADE, ILUMINACAO E TECNOLOGIA LTDA",ALEX LACERDA RAMOS / BRUNO RICCELLI DOS SANTOS SILVA / DANILO REIS DE VASCONCELOS / ELIÂNDREA VITÓRIA SOUSA MELO / FRANCISCO AURICIO GOMES SANTOS / FRANCISCO ERISNILTON SILVA FREITAS / MANOEL LOPES FILHO / ROGÉRIO GUERRA DIÓGENES FILHO / RONALDO TADEU PONTES MILFONT / THALIA ELLEN ARAUJO DO AMARAL,-,,
Ceará,IFCE,BR 51 2021 002377 3,07/10/2021,MITS Chamados, OUTROS,IN-02,TI-01,"INSTITUTO FEDERAL DE EDUCAÇÃO, CIÊNCIA E TECNOLOGIA DO CEARÁ / MOBIT - MOBILIDADE, ILUMINACAO E TECNOLOGIA LTDA",ALEX LACERDA RAMOS / BRUNO RICCELLI DOS SANTOS SILVA / DANILO REIS DE VASCONCELOS / ELIÂNDREA VITÓRIA SOUSA MELO / FRANCISCO AURICIO GOMES SANTOS / FRANCISCO ERISNILTON SILVA FREITAS / MANOEL LOPES FILHO / ROGÉRIO GUERRA DIÓGENES FILHO / RONALDO TADEU PONTES MILFONT / THALIA ELLEN ARAUJO DO AMARAL,-,,
Ceará,IFCE,BR 51 2021 002375 7,07/10/2021,Interface Cérebro-Computador,C++,SD-01,SO-09,"INSTITUTO FEDERAL DE EDUCAÇÃO, CIÊNCIA E TECNOLOGIA DO CEARÁ / IPADE - INSTITUTO PARA O DESENVOLVIMENTO DA EDUCAÇÃO LTDA / SOFTBUILDER INFORMÁTICA LTDA",CIDCLEY TEIXEIRA DE SOUZA / ALYSON NORONHA BEZERRA SILVA / EDGAR MARÇAL DE BARROS FILHO / FRANCISCO WESLEY DE PAULA ALMEIDA / IAGO DA SILVA ALVES / JAGNI DASA HORTA BEZERRA / KEVINY MAGALHÃES QUEIROZ / LUCAS SEVERO MELO,-,,
Ceará,IFCE,BR 51 2021 002353 6,05/10/2021,Módulo Inteligente de identificação e registro de humor de pacientes para telemedicina em Psiquiatria,FRAMEWORK / OUTROS / PYTHON,SD-08,TC-04,"NSTITUTO FEDERAL DE EDUCAÇÃO, CIÊNCIA E TECNOLOGIA DO CEARÁ / KIRON TECNOLOGIA E SERVICOS MEDICOS LTDA / M2C CONSULTORIA E SOLUÇÕES EMPRESARIAIS", ADAILTON DOS SANTOS HOLANDA / AUZUIR RIPARDO DE ALEXANDRIA / EDSON CAVALCANTI NETO / GABRIEL TAVARES DE MELO FREITAS / ISAC DO NASCIMENTO LIRA / LEONARDO AUGUSTO NEGREIROS PARENTE CAPELA SAMPAIO / MARCELLO CARVALHO DOS REIS ,-,,
Ceará,IFCE,BR 51 2021 002352 8,05/10/2021,Lemmstemize - um algoritmo de normalização de português brasileiro baseado em regras,PYTHON,IF-02,IA-03,"INSTITUTO FEDERAL DE EDUCAÇÃO, CIÊNCIA E TECNOLOGIA DO CEARÁ / SIEMENS HEALTHINEERS",ALYSON BEZERRA NOGUEIRA RIBEIRO / FÁBIO DE ARAÚJO PEREIRA / LEVI CORDEIRO CARVALHO / LUIZ FELIPE SOUSA MACIEL / NATÁLIA RIOS DE SOUSA / RENATO RODRIGUES VIEIRA DOS SANTOS / ROMULO LOPES FRUTUOSO / SAULO MACÊDO MAIA / TARIQUE DA SILVEIRA CAVALCANTE / THOMAZ MAIA DE ALMEIDA / WELLINGTON NOBERTO DA SILVA ARAUJO,-,,
Ceará,IFCE,BR 51 2021 002351 0,05/10/2021,Lemmstemize - adaptação de lematizador em pr-br para uso paralelo com TensorFlow,PYTHON,IF-02,IA-03,"INSTITUTO FEDERAL DE EDUCAÇÃO, CIÊNCIA E TECNOLOGIA DO CEARÁ / SIEMENS HEALTHINEERS",ALYSON BEZERRA NOGUEIRA RIBEIRO / FÁBIO DE ARAÚJO PEREIRA / LEVI CORDEIRO CARVALHO / LUIZ FELIPE SOUSA MACIEL / NATÁLIA RIOS DE SOUSA / RENATO RODRIGUES VIEIRA DOS SANTOS / ROMULO LOPES FRUTUOSO / SAULO MACÊDO MAIA / TARIQUE DA SILVEIRA CAVALCANTE / THOMAZ MAIA DE ALMEIDA / WELLINGTON NOBERTO DA SILVA ARAUJO,-,,
Ceará,IFCE,BR 51 2021 002350 1,05/10/2021,Lemmstemize - adaptação de stemizador em pr-br para uso paralelo com TensorFlow,PYTHON,IF-02,IA-03,"INSTITUTO FEDERAL DE EDUCAÇÃO, CIÊNCIA E TECNOLOGIA DO CEARÁ / SIEMENS HEALTHINEERS",ALYSON BEZERRA NOGUEIRA RIBEIRO / FÁBIO DE ARAÚJO PEREIRA / LEVI CORDEIRO CARVALHO / LUIZ FELIPE SOUSA MACIEL / NATÁLIA RIOS DE SOUSA / RENATO RODRIGUES VIEIRA DOS SANTOS / ROMULO LOPES FRUTUOSO / SAULO MACÊDO MAIA / TARIQUE DA SILVEIRA CAVALCANTE / THOMAZ MAIA DE ALMEIDA / WELLINGTON NOBERTO DA SILVA ARAUJO,-,,
Ceará,IFCE,BR 51 2021 002334 0,04/10/2021,Adaptação de stemizador (SnowBall) para uso paralelo com TensorFlow em pt-br,PYTHON,IF-02,IA-03," INSTITUTO FEDERAL DE EDUCAÇÃO, CIÊNCIA E TECNOLOGIA DO CEARÁ / SIEMENS HEALTHINEERS",ALYSON BEZERRA NOGUEIRA RIBEIRO / FÁBIO DE ARAÚJO PEREIRA / LEVI CORDEIRO CARVALHO / LUIZ FELIPE SOUSA MACIEL / NATÁLIA RIOS DE SOUSA / RENATO RODRIGUES VIEIRA DOS SANTOS / ROMULO LOPES FRUTUOSO / SAULO MACÊDO MAIA / TARIQUE DA SILVEIRA CAVALCANTE / THOMAZ MAIA DE ALMEIDA / WELLINGTON NOBERTO DA SILVA ARAUJO,-,,
Ceará,IFCE,BR 51 2021 002332 3,04/10/2021,Adaptação de lematizador (Stanza) para uso paralelo com TensorFlow em pt-br,PYTHON,IF-02,IA-03," INSTITUTO FEDERAL DE EDUCAÇÃO, CIÊNCIA E TECNOLOGIA DO CEARÁ / SIEMENS HEALTHINEERS", ALYSON BEZERRA NOGUEIRA RIBEIRO / FÁBIO DE ARAÚJO PEREIRA / LEVI CORDEIRO CARVALHO / LUIZ FELIPE SOUSA MACIEL / NATÁLIA RIOS DE SOUSA / RENATO RODRIGUES VIEIRA DOS SANTOS / ROMULO LOPES FRUTUOSO / SAULO MACÊDO MAIA / TARIQUE DA SILVEIRA CAVALCANTE / THOMAZ MAIA DE ALMEIDA / WELLINGTON NOBERTO DA SILVA ARAUJO,-,,
Ceará,IFCE,BR 51 2021 001313 1,16/06/2021,SisRef IFCE front end, CSS / HTML / JAVA SCRIPT,ED-06,AP-01,"INSTITUTO FEDERAL DE EDUCAÇÃO, CIÊNCIA E TECNOLOGIA DO CEARÁ", JOÃO DENILSON SOUZA DOS SANTOS / PEDRO LUIS SARAIVA BARBOSA,-,,
Ceará,IFCE,BR 51 2021 001278 0,12/06/2021,Sistema de recomendação para análise do uso de cinto de segurança em imagens de trânsito,PYTHON,TP-04," FA-01 , IA-01 , IA-02","ATLANTA TECNOLOGIA DE INFORMAÇÃO LTDA / INSTITUTO FEDERAL DE EDUCAÇÃO, CIÊNCIA E TECNOLOGIA DO CEARÁ", FRANCISCO HÉRCULES DOS SANTOS SILVA / GERALDO LUIS BEZERRA RAMALHO / MARDÔNIO JÚNIOR MATOS DUARTE / NAVAR DE MEDEIROS MENDONÇA E NASCIMENTO / PEDRO PEDROSA REBOUÇAS FILHO,-,,
Ceará,IFCE,BR 51 2021 001277 1,11/06/2021,Alfa Brain, JAVA / MYSQL / OUTROS,FN-06,FA-01,"INSTITUTO FEDERAL DE EDUCAÇÃO, CIÊNCIA E TECNOLOGIA DO CEARÁ / RR ASSESSORIA, SERVIC¸OS E COBRANC¸A",ALEX LACERDA RAMOS / DANILO REIS DE VASCONCELOS / ERIK BERNARDO DA SILVA / FRANCISCO KEVEN ALMEIDA DA SILVA / RONALDO TADEU PONTES MILFONT,-,,
Ceará,IFCE,BR 51 2021 001268 2,11/06/2021,MInD - Model for Intelligence Development in Java,JAVA , CO-01 / CO-03 / ED-04 / IF-01 / IF-07 / IN-02," DS-01 , DS-04 , DS-06 , IA-01"," INSTITUTO FEDERAL DE EDUCAÇÃO, CIÊNCIA E TECNOLOGIA DO CEARÁ", RENATO LENZ COSTA LIMA,-,,
Ceará,IFCE,BR 51 2021 001257 7,10/06/2021,Ferramenta de backend do Vigilante Virtual para suprir aplicativo mobile,C / C++ / PYTHON,IF-02,IA-03 / TC-04,"INSTITUTO FEDERAL DE EDUCAÇÃO, CIÊNCIA E TECNOLOGIA DO CEARÁ / LOCKTEC TECNOLOGIA EM SEGURANÇA INTEGRADA LTDA", CAIO CAMPÊLO DE MACÊDO / CARLOS MAURICIO JABORANDY DE MATTOS DOURADO JÚNIOR / GABRIEL BANDEIRA HOLANDA / HELDER BOMFIM DE MACÊDO / JOÃO WELLINGTON MENDES DE SOUZA / PEDRO PEDROSA REBOUÇAS FILHO / VITO CAMPÊLO DE MACÊDO,-,,
Ceará,IFCE,BR 51 2021 001256 9,10/06/2021,Aplicativo Android Para Portaria Virtual Utilizando Serviços De Visão Computaciona, OUTROS,IF-02,IA-03 / TC-04,"INSTITUTO FEDERAL DE EDUCAÇÃO, CIÊNCIA E TECNOLOGIA DO CEARÁ / LOCKTEC TECNOLOGIA EM SEGURANÇA INTEGRADA",CAIO CAMPÊLO DE MACÊDO / CARLOS MAURICIO JABORANDY DE MATTOS DOURADO JÚNIOR / HELDER BOMFIM DE MACÊDO / PEDRO PEDROSA REBOUÇAS FILHO / VIRGÍNIA XAVIER NUNES / VITO CAMPÊLO DE MACÊDO,-,,
Ceará,IFCE,BR 51 2021 001255 0,10/06/2021,Reconhecimento facial para identificação de pessoas em áreas controladas dentro do condomínio,PYTHON,IF-02," IA-01 , TC-04","INSTITUTO FEDERAL DE EDUCAÇÃO, CIÊNCIA E TECNOLOGIA DO CEARÁ / LOCKTEC TECNOLOGIA EM SEGURANÇA INTEGRADA LTDA",ALDISIO GONÇALVES MEDEIROS / CAIO CAMPÊLO DE MACÊDO / CARLOS MAURICIO JABORANDY DE MATTOS DOURADO JÚNIOR / HELDER BOMFIM DE MACÊDO / PEDRO PEDROSA REBOUÇAS FILHO / SOLON ALVES PEIXOTO / VITO CAMPÊLO DE MACÊDO,-,,
Ceará,IFCE,BR 51 2021 001170 8,31/05/2021,Firmware para aplicações em sistemas eólicos,C,EN-04,IT-02," DPM SERVIÇOS DE AUTOMAÇÃO LTDA / INSTITUTO FEDERAL DE EDUCAÇÃO, CIÊNCIA E TECNOLOGIA DO CEARÁ",ERIC SAMIR SANTANA NOBRE / FRANCISCO TEIXEIRA NETO / IVO CARRILHO FREIRE / VICTOR DALL MASS FERNANDES,-,,
Ceará,IFCE,BR 51 2021 001168 6,31/05/2021,Algoritmo de comunicação IoT,C / PYTHON,EN-04," CD-01 , CD-04"," DDORA SISTEMAS DE INFORMAÇÃO LTDA / INSTITUTO FEDERAL DE EDUCAÇÃO, CIÊNCIA E TECNOLOGIA DO CEARÁ", FELIPE HALMENSCHLAGER DELVAN / LEONARDO DE HOLANDA COSTA NUNES / RYLLARI RAIANNE MARQUES DE SANTANA,-,,
Ceará,IFCE,BR 51 2021 001167 8,31/05/2021,Segmentação de Pulmão,PYTHON,SD-09,TC-04," INSTITUTO FEDERAL DE EDUCAÇÃO, CIÊNCIA E TECNOLOGIA DO CEARÁ / RIO ELBA SOLUCOES DIGITAIS EIRELI ? EPP FP ADMINISTRAÇÃO E PARTICIPAÇÃO LTDA",ALYSON BEZERRA NOGUEIRA RIBEIRO / PEDRO ELIAS RIBEIRO DOS SANTOS / RENÊ RIPARDO CALIXTO / SAULO MACEDO MAIA / TARIQUE DA SILVEIRA CAVALCANTE / THOMAZ MAIA DE ALMEIDA / VALBERTO ENOC RODRIGUES DA SILVA FILHO,-,,
Ceará,IFCE,BR 51 2021 001166 0,31/05/2021,Segmentação de Nódulos Sólidos,PYTHON,SD-09,TC-04,"INSTITUTO FEDERAL DE EDUCAÇÃO, CIÊNCIA E TECNOLOGIA DO CEARÁ / RIO ELBA SOLUCOES DIGITAIS EIRELI ? EPP FP ADMINISTRAÇÃO E PARTICIPAÇÃO LTDA",ALYSON BEZERRA NOGUEIRA RIBEIRO / PEDRO ELIAS RIBEIRO DOS SANTOS / RENÊ RIPARDO CALIXTO / SAULO MACEDO MAIA / TARIQUE DA SILVEIRA CAVALCANTE / THOMAZ MAIA DE ALMEIDA / VALBERTO ENOC RODRIGUES DA SILVA FILHO,-,,
Ceará,IFCE,BR 51 2021 001165 1,31/05/2021,Segmentação de Nódulos Não Sólidos,PYTHON,SD-09,TC-04,"INSTITUTO FEDERAL DE EDUCAÇÃO, CIÊNCIA E TECNOLOGIA DO CEARÁ / RIO ELBA SOLUCOES DIGITAIS EIRELI ? EPP FP ADMINISTRAÇÃO E PARTICIPAÇÃO LTDA", ALYSON BEZERRA NOGUEIRA RIBEIRO / PEDRO ELIAS RIBEIRO DOS SANTOS / RENÊ RIPARDO CALIXTO / SAULO MACEDO MAIA / TARIQUE DA SILVEIRA CAVALCANTE / THOMAZ MAIA DE ALMEIDA / VALBERTO ENOC RODRIGUES DA SILVA FILHO,-,,
Ceará,IFCE,BR 51 2021 001164 3,31/05/2021,Gerador de Métricas,PYTHON,IN-02,DS-01,"  INSTITUTO FEDERAL DE EDUCAÇÃO, CIÊNCIA E TECNOLOGIA DO CEARÁ / RIO ELBA SOLUCOES DIGITAIS EIRELI ? EPP FP ADMINISTRAÇÃO E PARTICIPAÇÃO LTDA",ALYSON BEZERRA NOGUEIRA RIBEIRO / PEDRO ELIAS RIBEIRO DOS SANTOS / RENÊ RIPARDO CALIXTO / SAULO MACEDO MAIA / TARIQUE DA SILVEIRA CAVALCANTE / THOMAZ MAIA DE ALMEIDA / VALBERTO ENOC RODRIGUES DA SILVA FILHO,-,,
Ceará,IFCE,BR 51 2021 001163 5,31/05/2021,Detecção de Nódulos,PYTHON,SD-09,TC-04,"INSTITUTO FEDERAL DE EDUCAÇÃO, CIÊNCIA E TECNOLOGIA DO CEARÁ / RIO ELBA SOLUCOES DIGITAIS EIRELI ? EPP FP ADMINISTRAÇÃO E PARTICIPAÇÃO LTDA", ALYSON BEZERRA NOGUEIRA RIBEIRO / PEDRO ELIAS RIBEIRO DOS SANTOS / RENÊ RIPARDO CALIXTO / SAULO MACEDO MAIA / TARIQUE DA SILVEIRA CAVALCANTE / THOMAZ MAIA DE ALMEIDA / VALBERTO ENOC RODRIGUES DA SILVA FILHO,-,,
Ceará,IFCE,BR 51 2021 001160 0,30/05/2021,Classificação de nódulos sólidos e não sólidos,PYTHON,SD-09,TC-04,"INSTITUTO FEDERAL DE EDUCAÇÃO, CIÊNCIA E TECNOLOGIA DO CEARÁ / RIO ELBA SOLUCOES DIGITAIS EIRELI ? EPP FP ADMINISTRAÇÃO E PARTICIPAÇÃO LTDA",ALYSON BEZERRA NOGUEIRA RIBEIRO / PEDRO ELIAS RIBEIRO DOS SANTOS / RENÊ RIPARDO CALIXTO / SAULO MACEDO MAIA / TARIQUE DA SILVEIRA CAVALCANTE / THOMAZ MAIA DE ALMEIDA / VALBERTO ENOC RODRIGUES DA SILVA FILHO,-,,
Ceará,IFCE,BR 51 2021 001159 7,30/05/2021,Memorial,PYTHON,IF-10,GI-01," DULANE GESTÃO DE NEGÓCIOS S.A / INSTITUTO FEDERAL DE EDUCAÇÃO, CIÊNCIA E TECNOLOGIA DO CEARÁ",DAVI PINHO DA SILVA / JOEL VICTOR DE CASTRO GALVÃO / LUCAS SILVA DE SOUSA,-,,
Ceará,IFCE,BR 51 2021 001158 9,30/05/2021,MemorialLive,PYTHON,IF-07,SO-04,"DULANE GESTÃO DE NEGÓCIOS S.A / INSTITUTO FEDERAL DE EDUCAÇÃO, CIÊNCIA E TECNOLOGIA DO CEARÁ",DAVI PINHO DA SILVA / JOEL VICTOR DE CASTRO GALVÃO / LUCAS SILVA DE SOUSA,-,,
Ceará,IFCE,BR 51 2021 001157 0,28/05/2021,SisRef - IFCE front-end,CSS / HTML / JAVA SCRIPT,ED-06,AP-01,"INSTITUTO FEDERAL DE EDUCAÇÃO, CIÊNCIA E TECNOLOGIA DO CEARÁ",  JOÃO DENILSON SOUZA DOS SANTOS / PEDRO LUIS SARAIVA BARBOSA,-,,
Ceará,IFCE,BR 51 2021 001156 2,28/05/2021,BENTHAM,  JAVA / JAVA SCRIPT / SQL, AD-01 / AD-02 / AD-05 / AD-06 / CC-01 / CC-03 / CC-04,"AP-01 , AP-02 , AP-03 , AP-04 , AP-05 , AV-02 , GI-01 , GI-04","INSTITUTO FEDERAL DE EDUCAÇÃO, CIÊNCIA E TECNOLOGIA DO CEARÁ / QUANTA CONSULTORIA LTDA", ALICE FEITOSA BARBOSA / ANDRÉ SALES SOUSA / ANTÔNIO MAURO BARBOSA DE OLIVEIRA / ARTHUR BEZERRA NUNES / CARINA TEIXEIRA DE OLIVEIRA / CELECINA DE MARIA VELAS SALES / EMANUEL MORAES DE ALMEIDA / GUILHERME MARTINS DE OLIVEIRA / GUSTAVO BRASILEIRO COELHO / IESUS BATISTA DA SILVA / IGOR MARTINS GALDINO / IVYSON LUCAS DE LIMA SILVA / JOSE RIBAMAR DE SOUSA / JOSE WILTON FERREIRA DO NASCIMENTO / JOSÉ VICTOR DOS SANTOS DE LIMA / LETÍCIA GABRIELLE PEREIRA BARBOSA DOS SANTO / LUAN DOUGLAS MAIA DA SILVA / MARCOS ANTÔNIO DA COSTA DA SILVA FILHO / MATHEUS GURGEL RIBEIRO / MAÍRA SALES SOUSA BORGES / REINALDO BEZERRA BRAGA / RENATO ALEXANDRE COSTA FREITAS / RENATO ALVES DE OLIVEIRA / RUI SANTIAGO DE SOUSA / SAMUEL LUCAS DA SILVA SENA / THIAGO FELIPPE DE LIMA BANDEIRA,-,,
Ceará,IFCE,BR 51 2021 001106 6,24/05/2021,Sistema CONEQUI - Controle de Equipamentos,CSS / DJANGO / FRAMEWORK / HTML / JAVA SCRIPT / OUTROS / PYTHON / SQL,AD-08,AP-03,"INSTITUTO FEDERAL DE EDUCAÇÃO, CIÊNCIA E TECNOLOGIA DO CEARÁ",ANDERSON PASSOS DE ARAGÃO / CYNTHIA PINHEIRO SANTIAGO / DANIEL ALBUQUERQUE CARVALHO / DAVID DE MIRANDA RODRIGUES / LUCIANA ALVES AMARAL / NÉCIO DE LIMA VERAS,-,,
Ceará,IFCE,BR 51 2021 001105 8,24/05/2021,Módulo com metalinguagem para extração automática de dados em sistemas web,PYTHON,IF-02,LG-02," BV SERVICOS TECNOLOGICOS EIRELI / INSTITUTO FEDERAL DE EDUCAÇÃO, CIÊNCIA E TECNOLOGIA DO CEARÁ",AJALMAR RÊGO DA ROCHA NETO / CARLOS HENRIQUE LEITÃO CAVALCANTE / ÁLISSON GOMES LINHARES,-,,
Ceará,IFCE,BR 51 2021 000897 9,04/05/2021,AQUAMEAÇA: Um sistema para identificação e monitoramento de ameaças a ecossistemas aquáticos,CSS / HTML / JAVA / JAVA SCRIPT / PHP,MA-04,AP-01," INSTITUTO FEDERAL DE EDUCAÇÃO, CIÊNCIA E TECNOLOGIA DA PARAÍBA / INSTITUTO FEDERAL DE EDUCAÇÃO, CIÊNCIA E TECNOLOGIA DE PERNAMBUCO (IFPE) / INSTITUTO FEDERAL DE EDUCAÇÃO, CIÊNCIA E TECNOLOGIA DO CEARÁ",EVALDO DE LIRA AZEVÊDO / HUMBERTO BELTRÃO DA CUNHA JÚNIOR / LEONARDO SILVA DE OLIVEIRA / PEDRO WILLIAN DE OLIVEIRA VIEIRA / RODRIGO CADEIRA SOARES / SUÊNIA DOS SANTOS DA SILVA,-,,
Ceará,IFCE,BR 51 2021 000786 7,20/04/2021,SGA,PHP,IN-05,AT-05,"INSTITUTO FEDERAL DE EDUCAÇÃO, CIÊNCIA E TECNOLOGIA DO CEARÁ / METALURGICA W3SAT LTDA", ANDRÉ LUIZ CARNEIRO DE ARAÚJO / BRUNNA CONCEIÇÃO DE PAULO / JOÃO PEDRO BRASIL LIMA / ROGÉRIO GUERRA DIÓGENES FILHO,-,,
Ceará,IFCE,BR 51 2021 000777 8,19/04/2021,Composição Corporal Mobile,C / C++ / JAVA / SWIFT,IN-02,IA-01," INSTITUTO FEDERAL DE EDUCAÇÃO, CIÊNCIA E TECNOLOGIA DO CEARÁ / LANNES EMPREENDIMENTOS", ANTONIO CARLOS DA SILVA BARROS / GABRIEL BANDEIRA HOLANDA / JOÃO WELLINGTON MENDES DE SOUZA / LUIZ LANNES LOUREIRO / PEDRO PEDROSA REBOUÇAS FILHO / SHARA SHAMI ARAÚJO ALVES / SUANE PIRES PINHEIRO DA SILVA / VIRGÍNIA XAVIER NUNES,-,,
Ceará,IFCE,BR 51 2021 000775 1,19/04/2021,Servidor WEB para processamento de imagens,PYTHON, SV-01 / TP-04, TC-01," INSTITUTO FEDERAL DE EDUCAÇÃO, CIÊNCIA E TECNOLOGIA DO CEARÁ / MOBIT - MOBILIDADE, ILUMINACAO E TECNOLOGIA LTDA", ALYSON BEZERRA NOGUEIRA RIBEIRO / EDSON CAVALCANTI NETO / FÁBIO DE ARAÚJO PEREIRA / GILDERLANE RIBEIRO ALEXANDRE / JONAS RODRIGUES VIEIRA DOS SANTOS / LEVI CORDEIRO CARVALHO / LUÍZ FELIPE SOUSA MACIEL / NATÁLIA RIOS DE SOUSA / RENATO RODRIGUES VIEIRA DOS SANTOS / RODRIGO FERNANDES FREITAS / RÔMULO LOPES FRUTUOSO / SAMUEL LUZ GOMES / TARIQUE DA SILVEIRA CAVALCANTE / WELLINGTON NOBERTO DA SILVA ARAUJO,-,,
Ceará,IFCE,BR 51 2021 000774 3,19/04/2021,Módulo de aprimoramento de imagens noturnas de veículos,PYTHON, SV-01 / TP-04, TC-04,"  INSTITUTO FEDERAL DE EDUCAÇÃO, CIÊNCIA E TECNOLOGIA DO CEARÁ / MOBIT - MOBILIDADE, ILUMINACAO E TECNOLOGIA LTDA",ALYSON BEZERRA NOGUEIRA RIBEIRO / EDSON CAVALCANTI NETO / FÁBIO DE ARAÚJO PEREIRA / GILDERLANE RIBEIRO ALEXANDRE / JONAS RODRIGUES VIEIRA DOS SANTOS / LEVI CORDEIRO CARVALHO / LUÍZ FELIPE SOUSA MACIEL / NATÁLIA RIOS DE SOUSA / RENATO RODRIGUES VIEIRA DOS SANTOS / RODRIGO FERNANDES FREITAS / RÔMULO LOPES FRUTUOSO / SAMUEL LUZ GOMES / TARIQUE DA SILVEIRA CAVALCANTE / WELLINGTON NOBERTO DA SILVA ARAUJO,-,,
Ceará,IFCE,BR 51 2021 000773 5,19/04/2021,Módulo de detecção de sinalização vertical em vias,PYTHON, SV-01 / TP-04, TC-04,"INSTITUTO FEDERAL DE EDUCAÇÃO, CIÊNCIA E TECNOLOGIA DO CEARÁ / MOBIT - MOBILIDADE, ILUMINACAO E TECNOLOGIA LTDA",ALYSON BEZERRA NOGUEIRA RIBEIRO / EDSON CAVALCANTI NETO / FÁBIO DE ARAÚJO PEREIRA / GILDERLANE RIBEIRO ALEXANDRE / JONAS RODRIGUES VIEIRA DOS SANTOS / LEVI CORDEIRO CARVALHO / LUÍZ FELIPE SOUSA MACIEL / NATÁLIA RIOS DE SOUSA / RENATO RODRIGUES VIEIRA DOS SANTOS / RODRIGO FERNANDES FREITAS / RÔMULO LOPES FRUTUOSO / SAMUEL LUZ GOMES / TARIQUE DA SILVEIRA CAVALCANTE / WELLINGTON NOBERTO DA SILVA ARAUJO,-,,
Ceará,IFCE,BR 51 2021 000772 7,19/04/2021,Módulo de detecção de objetos em cenas de trânsito,PYTHON, SV-01 / TP-04, TC-04,"INSTITUTO FEDERAL DE EDUCAÇÃO, CIÊNCIA E TECNOLOGIA DO CEARÁ / MOBIT - MOBILIDADE, ILUMINACAO E TECNOLOGIA LTDA",ALYSON BEZERRA NOGUEIRA RIBEIRO / EDSON CAVALCANTI NETO / FÁBIO DE ARAÚJO PEREIRA / GILDERLANE RIBEIRO ALEXANDRE / JONAS RODRIGUES VIEIRA DOS SANTOS / LEVI CORDEIRO CARVALHO / LUÍZ FELIPE SOUSA MACIEL / NATÁLIA RIOS DE SOUSA / RENATO RODRIGUES VIEIRA DOS SANTOS / RODRIGO FERNANDES FREITAS / RÔMULO LOPES FRUTUOSO / SAMUEL LUZ GOMES / TARIQUE DA SILVEIRA CAVALCANTE / WELLINGTON NOBERTO DA SILVA ARAUJO,-,,
Ceará,IFCE,BR 51 2021 000769 7,19/04/2021,Módulo de detecção de buracos em vias,PYTHON, SV-01 / TP-04, TC-04,"INSTITUTO FEDERAL DE EDUCAÇÃO, CIÊNCIA E TECNOLOGIA DO CEARÁ / MOBIT - MOBILIDADE, ILUMINACAO E TECNOLOGIA LTDA",ALYSON BEZERRA NOGUEIRA RIBEIRO / EDSON CAVALCANTI NETO / FÁBIO DE ARAÚJO PEREIRA / GILDERLANE RIBEIRO ALEXANDRE / JONAS RODRIGUES VIEIRA DOS SANTOS / LEVI CORDEIRO CARVALHO / LUÍZ FELIPE SOUSA MACIEL / NATÁLIA RIOS DE SOUSA / RENATO RODRIGUES VIEIRA DOS SANTOS / RODRIGO FERNANDES FREITAS / RÔMULO LOPES FRUTUOSO / SAMUEL LUZ GOMES / TARIQUE DA SILVEIRA CAVALCANTE / WELLINGTON NOBERTO DA SILVA ARAUJO,-,,
Ceará,IFCE,BR 51 2021 000766 2,18/04/2021,Módulo de classificação de marca e modelo de veículos,PYTHON, SV-01 / TP-01, TC-04,"MOBIT - MOBILIDADE, ILUMINACAO E TECNOLOGIA LTDA / INSTITUTO FEDERAL DE EDUCAÇÃO, CIÊNCIA E TECNOLOGIA DO CEARÁ", ALYSON BEZERRA NOGUEIRA RIBEIRO / EDSON CAVALCANTI NETO / FÁBIO DE ARAÚJO PEREIRA / GILDERLANE RIBEIRO ALEXANDRE / JONAS RODRIGUES VIEIRA DOS SANTOS / LEVI CORDEIRO CARVALHO / LUÍZ FELIPE SOUSA MACIEL / NATÁLIA RIOS DE SOUSA / RENATO RODRIGUES VIEIRA DOS SANTOS / RODRIGO FERNANDES FREITAS / RÔMULO LOPES FRUTUOSO / SAMUEL LUZ GOMES / TARIQUE DA SILVEIRA CAVALCANTE / WELLINGTON NOBERTO DA SILVA ARAUJO,-,,
Ceará,IFCE,BR 51 2021 000765 4,18/04/2021,Módulo de classificação de cor de veículos,PYTHON, SV-01 , TC-04,"MOBIT - MOBILIDADE, ILUMINACAO E TECNOLOGIA LTDA / INSTITUTO FEDERAL DE EDUCAÇÃO, CIÊNCIA E TECNOLOGIA DO CEARÁ", ALYSON BEZERRA NOGUEIRA RIBEIRO / EDSON CAVALCANTI NETO / FÁBIO DE ARAÚJO PEREIRA / GILDERLANE RIBEIRO ALEXANDRE / JONAS RODRIGUES VIEIRA DOS SANTOS / LEVI CORDEIRO CARVALHO / LUÍZ FELIPE SOUSA MACIEL / NATÁLIA RIOS DE SOUSA / RENATO RODRIGUES VIEIRA DOS SANTOS / RODRIGO FERNANDES FREITAS / RÔMULO LOPES FRUTUOSO / SAMUEL LUZ GOMES / TARIQUE DA SILVEIRA CAVALCANTE / WELLINGTON NOBERTO DA SILVA ARAUJO,-,,
Ceará,IFCE,BR 51 2021 000763 8,18/04/2021,Plataforma multilateral para profissionais de saúde, JAVA SCRIPT / OUTROS / PYTHON / SQL, SD-08,AP-01," CLINICA BOA SAUDE / INSTITUTO FEDERAL DE EDUCAÇÃO, CIÊNCIA E TECNOLOGIA DO CEARÁ", ADAILTON DOS SANTOS HOLANDA / ANA ADRIANIZE MENDES VIANA / ANDRÉ LUIZ DE SOUZA ARAÚJO / AUZUIR RIPARDO DE ALEXANDRIA / CLERIA SILVA DE FREITAS / EDSON CAVALCANTI NETO / FRANCISCO RONALD ARAÚJO BARBOSA / MARCELO ARAUJO LIMA / MARCELO DE CASTRO SILVA FREITAS / MARCOS GABRIEL SOUZA DANTAS / RAFAEL SILVA ALVES / RÔMULO LOPES FRUTUOSO / SAULO MACEDO MAIA / VICTOR JOSÉ TIMBÓ GONDIM / WELLINGTON RIBEIRO DE MENEZES,-,,
Ceará,IFCE,BR 51 2021 000540 6,19/03/2021,Virtual Stations,  C# / UNITY,SD-01,AP-01,"INSTITUTO FEDERAL DE EDUCAÇÃO, CIÊNCIA E TECNOLOGIA DO CEARÁ / IPADE - INSTITUTO PARA O DESENVOLVIMENTO DA EDUCACAO LTDA / SOFTBUILDER INFORMATICA LTDA",ALEXANDRE LOUREIRO FARIA / ARNALDO AIRES PEIXOTO JÚNIOR / CIDCLEY TEIXEIRA DE SOUZA / EDGAR MARÇAL DE BARROS FILHO / JOÃO FILIPE DIAS MORADA,-,,
Ceará,IFCE,BR 51 2021 000539 2,19/03/2021,Eyeglow,OUTROS,SD-01,AP-01,"INSTITUTO FEDERAL DE EDUCAÇÃO, CIÊNCIA E TECNOLOGIA DO CEARÁ / IPADE - INSTITUTO PARA O DESENVOLVIMENTO DA EDUCACAO LTDA / SOFTBUILDER INFORMATICA LTDA", CIDCLEY TEIXEIRA DE SOUZA / EDGAR MARÇAL DE BARROS FILHO / FRANCISCO EVERARDO LIMA DE CASTRO JUNIOR / INGRID CORREIA NOGUEIRA / JONATHAN ALVES JARDIM / JOÃO FILIPE DIAS MORADA / PALOMA CASTRO VERÇOSA / PAULO ROGÉRIO MATHEUS BONFIM LEITÃO,-,,
