UF,Sigla,Pedido,Depósito,Título,Linguagem,Campo de Aplicação,Tipo Programa,Nome do Titular:,Nome do Autor,Nome do Procurador:,,
Ceará,UVA,BR 51 2018 051772 2,26/09/2018,SISTEMA DO RESTAURANTE UNIVERSITÁRIO,JAVA / PHP,IF-07,IA-02,UNIVERSIDADE ESTADUAL VALE DO ACARAÚ,BRUNO DE OLIVEIRA MACHADO / DEYVID SA CAMILO / GUSTAVO FONTELES MORAIS RODRIGUES / JORGE LUIS PIRES DE MORAES / JOSÉ SAMUEL MONTENEGRO SANTIAGO / JOYCE MONTE DE OLIVEIRA / LEONARDO JOSE MONTENEGRO SANTIAGO / LUIZ FELIPE NEVES GONÇALVES / MADSON AGUIAR RODRIGUES / PEDRO ROGER MAGALHAES VASCONCELOS,-,,
Ceará,UVA,BR 51 2018 001018 0,25/06/2018,Sistema de Gerenciamento de Laboratórios - Bluelabs,PHP,AD-02 / AD-08 / AD-09 / AD-10 / EC-06 / ED-04,"AP-01 , TC-01",UNIVERSIDADE ESTADUAL VALE DO ACARAÚ,RODRIGO MARANGUAPE SILVA DA CUNHA,-,, (Fernanda) - ok.
Ceará,URCA,BR 51 2022 001300 2,30/05/2022,SISPRAIA: Sistema Integrado para Gestão Ambiental Pública de Praias,JAVA SCRIPT,AD-02 /AD-02 F/ AD-04 / MA-01 / MA-02,AV-01,FUNDAÇÃO UNIVERSIDADE ESTADUAL DO CEARÁ - FUNECE / UNIVERSIDADE REGIONAL DO CARIRI - URCA,FRANCISCO EDMAR DE SOUSA SILVA PINHEIRO / FÁBIO PERDIGÃO VASCONCELOS / OTÁVIO AUGUSTO DE OLIVEIRA LIMA BARRA,-,,
Ceará,UECE,BR 51 2024 003584 2,30/09/2024,SP2Mic: Uma ferramenta para geração de código de microsserviços a partir de stored procedures,C# / OUTROS,IF-07,DS-01, FUNDAÇÃO UNIVERSIDADE ESTADUAL DO CEARÁ - FUNECE,INGRID GUEDES TELES COUTINHO / MARX HARON GOMES BARBOSA / PAULO HENRIQUE MENDES MAIA,-,,
Ceará,UECE,BR 51 2024 003130 8,27/08/2024,Bookstation - Sistema web de recomendação e gerenciamento de livros,PYTHON,IF-02 / IF-09,FA-01, FUNDAÇÃO UNIVERSIDADE ESTADUAL DO CEARÁ - FUNECE, ANDREI FREITAS COSTA NUNES DOS SANTOS / ISMAYLE DE SOUSA SANTOS,-,,
Ceará,UECE,BR 51 2024 003129 4,27/08/2024,FMC-MIL: Função para treinar uma rede neural para detecção de anomalias em vídeos de vigilância com múltiplas câmeras sobrepostas e com rótulos de vídeo,PYTHON,IN-02 /SV-01,"IA-01, TC-03", FUNDAÇÃO UNIVERSIDADE ESTADUAL DO CEARÁ - FUNECE, JOSÉ EVERARDO BESSA MAIA / SILAS SANTIAGO LOPES PEREIRA,-,,
Ceará,UECE,BR 51 2024 002945 1,14/08/2024,Informa Diabetes,OUTROS,ED-06 / SD-01,"DS-04, DS-06", FUNDAÇÃO UNIVERSIDADE ESTADUAL DO CEARÁ - FUNECE,  FLORÊNCIA GAMILEIRA NASCIMENTO / SHÉRIDA KARANINI PAZ DE OLIVEIRA,-,,
Ceará,UECE,BR 51 2024 002494 8,17/07/2024,Entrando na História: interagindo e escrevendo com personagens,C# / UNITY,CO-03/ ED-01/ ED-04,DS-04, FUNDAÇÃO UNIVERSIDADE ESTADUAL DO CEARÁ - FUNECE, DIOGO ROLIM SARAIVA DOS SANTOS / IVES MOREIRA GOMES / REGINA CLÁUDIA PINHEIRO,-,,
Ceará,UECE,BR 51 2024 002442 5,15/07/2024,Entrando na História: interagindo e escrevendo com personagens-Linux,C# / UNITY,CO-03/ ED-01/ ED-04,DS-04, FUNDAÇÃO UNIVERSIDADE ESTADUAL DO CEARÁ - FUNECE, DIOGO ROLIM SARAIVA DOS SANTOS / IVES MOREIRA GOMES / REGINA CLÁUDIA PINHEIRO,-,,
Ceará,UECE,BR 51 2024 002440 9,15/07/2024,App Entrando na História: interagindo e escrevendo com personagens,C# / UNITY,CO-03/ ED-01/ ED-04,DS-04, FUNDAÇÃO UNIVERSIDADE ESTADUAL DO CEARÁ - FUNECE, DIOGO ROLIM SARAIVA DOS SANTOS / IVES MOREIRA GOMES / REGINA CLÁUDIA PINHEIRO,-,,
Ceará,UECE,BR 51 2024 002233 3,28/06/2024,E-captar,JAVA SCRIPT,SD-07,AP-01, FUNDAÇÃO UNIVERSIDADE ESTADUAL DO CEARÁ - FUNECE,  SANDRO ROBERTO CAVALCANTE BANDEIRA,-,,
Ceará,UECE,BR 51 2024 002178 7,26/06/2024,SR-Edu: Sistema de recomendação de materiais para um ambiente virtual educacional,PYTHON,ED-04,DS-01, FUNDAÇÃO UNIVERSIDADE ESTADUAL DO CEARÁ - FUNECE,  HUGO FIRMINO DAMASCENO / LEONARDO SAMPAIO ROCHA,-,,
Ceará,UECE,BR 51 2024 001607 4,15/05/2024,Corrida contra o diabetes,C++, ED-01/ SD-01/ SD-07,ET-02,FUNDAÇÃO UNIVERSIDADE ESTADUAL DO CEARÁ - FUNECE,MATEUS COSTA AVELAR / NATÁLIA SILVA COSTA / PAULO HENRIQUE MENDES MAIA / SHERIDA KARANINI PAZ DE OLIVEIRA,-,,
Ceará,UECE,BR 51 2024 000921 3,21/03/2024,DEA-SQLi: Detecção Escalável de Ameaças de Injeção de SQL,PYTHON,TC-04, PD-01,FUNDAÇÃO UNIVERSIDADE ESTADUAL DO CEARÁ - FUNECE, MICHAEL SILVA DE SOUZA / RAFAEL LOPES GOMES / SILVIO EDUARDO SALES DE BRITTO RIBEIRO,-,,
Ceará,UECE,BR 51 2024 000920 5,21/03/2024,2LD-SQLi: Dupla Camada de Detecção de Injeção de SQL,PYTHON,TC-04, PD-01,FUNDAÇÃO UNIVERSIDADE ESTADUAL DO CEARÁ - FUNECE,MICHAEL SILVA DE SOUZA / RAFAEL LOPES GOMES / SILVIO EDUARDO SALES DE BRITTO RIBEIRO,-,,
Ceará,UECE,BR 51 2024 000782 2,13/03/2024,Rottas,OUTROS,IF-10/ TP-01/ TP-03," AP-01, FA-01, IA-01",FUNDAÇÃO UNIVERSIDADE ESTADUAL DO CEARÁ - FUNECE, FRANCISCO LAURINDO COSTA JUNIOR / ISMAYLE DE SOUSA SANTOS / MARCOS PATRICK SARAIVA DA SILVA / MATHEUS DE ALMEIDA ESTEBAN / RENAN MENDES FROTA / ROSSANA MARIA DE CASTRO ANDRADE,-,,
Ceará,UECE,BR 51 2024 000624 9,29/02/2024,T-For: An Adaptable Forecasting Model for Throughput Performance,PYTHON, TC-02 / TC-04," IA-01, TI-04",FUNDAÇÃO UNIVERSIDADE ESTADUAL DO CEARÁ - FUNECE, ARIEL LIMA DE CARVALHO PORTELA / RAFAEL DE ALMEIDA MENEZES / RAFAEL LOPES GOMES / SILVIO EDUARDO SALES DE BRITTO RIBEIRO,-,,
Ceará,UECE,BR 51 2024 000467 0,16/02/2024,Aplicativo de Teste do Relógio,OUTROS,SD-01/ SD-03/ SD-05/ SD-06/ SD-08,"AP-01, IA-02, TC-01",FUNDAÇÃO UNIVERSIDADE ESTADUAL DO CEARÁ - FUNECE,ANTÔNIO LUIZ MARTINS MAIA FILHO / CLÉLIA SANTANA REIS DAMÁSIO / DARIO BRITO CALÇADA / DYMAS DE SOUSA CUNHA / JOÃO VICTOR DE CASTRO OLIVEIRA / LEONARDO EVANGELISTA MESQUITA,-,,
Ceará,UECE,BR 51 2024 000466 1,16/02/2024,Aplicativo de Mini Exame de Estado Mental,OUTROS,SD-01/ SD-03/ SD-05 / SD-06/ SD-08,"AP-01, IA-02, TC-01",FUNDAÇÃO UNIVERSIDADE ESTADUAL DO CEARÁ - FUNECE,  ANTÔNIO LUIZ MARTINS MAIA FILHO / CLÉLIA SANTANA REIS DAMÁSIO / DARIO BRITO CALÇADA / DYMAS DE SOUSA CUNHA / JOÃO VICTOR DE CASTRO OLIVEIRA / LEONARDO EVANGELISTA MESQUITA,-,,
Ceará,UECE,BR 51 2024 000414 9,09/02/2024,Aplicativo de Teste de Fluência Verbal,FRAMEWORK,SD-01/ SD-03/ SD-05 / SD-06/ SD-08,"AP-01, IA-02, TC-01",FUNDAÇÃO UNIVERSIDADE ESTADUAL DO CEARÁ - FUNECE, ANTÔNIO LUIZ MARTINS MAIA FILHO / CLÉLIA SANTANA REIS DAMÁSIO / DARIO BRITO CALÇADA / DYMAS DE SOUSA CUNHA / JOÃO VICTOR DE CASTRO OLIVEIRA / LEONARDO EVANGELISTA MESQUITA,-,,
Ceará,UECE,BR 51 2024 000254 5,26/01/2024,WebMoney - Gestão de Finanças Pessoais,RUBY,FN-05,AP-02,FUNDAÇÃO UNIVERSIDADE ESTADUAL DO CEARÁ - FUNECE, ISMAYLE DE SOUSA SANTOS / RAIMUNDO ANGELIANO GONÇALVES DE SOUSA,-,,
Ceará,UECE,BR 51 2024 000076 3,09/01/2024,Aventura Bucal: Jogo digital educativo para prevenção e promoção da saúde bucal em crianças,UNITY,SD-11,ET-02,FUNDAÇÃO UNIVERSIDADE ESTADUAL DO CEARÁ - FUNECE,LUCIANA BONFIM JACÓ DE OLIVEIRA / MARIA SALETE BESSA JORGE / PAULO HENRIQUE MENDES MAIA,-,,
Ceará,UECE,BR 51 2023 003527 0,16/11/2023,SuperSeg: Superpixel Segmentation of DICOM Images,PYTHON,SD-06,TC-04,FUNDAÇÃO UNIVERSIDADE ESTADUAL DO CEARÁ - FUNECE,ALBERTO LUIAN DE LIMA MARQUES / DOMINGOS BRUNO SOUSA SANTOS / GABRIEL FURTADO LINS MELO / THELMO PONTES DE ARAUJO / VICTOR WILKER DOS SANTOS DE OLIVEIRA,-,,
Ceará,UECE,BR 51 2023 003243 3,26/10/2023,SysPAD: Proteção e Privacidade de Dados em Sistemas Legados,PYTHON,TC-04,PD-01,FUNDAÇÃO UNIVERSIDADE ESTADUAL DO CEARÁ - FUNECE,DANIELLE DOS SANTOS SILVA / DOUGLAS ARAÚJO DA SILVA / JONAS NOGUEIRA DA SILVA NETO / MARIA CLARA MESQUITA MOURA FERREIRA / MATHEUS MONTEIRO SILVEIRA / MICHAEL SILVA DE SOUZA / RAFAEL LOPES GOMES,-,,
Ceará,UECE,BR 51 2023 003241 7,26/10/2023,IoT-Anon: Data Anonimization Techniques in IoT Devices,C / C++,TC-04,PD-01,FUNDAÇÃO UNIVERSIDADE ESTADUAL DO CEARÁ - FUNECE,ARTHUR CORDEIRO URBANO / RAFAEL LOPES GOMES,-,,
Ceará,UECE,BR 51 2023 003240 9,26/10/2023,UroHemato App,HTML / JAVA SCRIPT / OUTROS, SD-03/ SD-05/ SD-08/ SD-09,"AP-01, DS-04, TC-01",FUNDAÇÃO UNIVERSIDADE ESTADUAL DO CEARÁ - FUNECE,MANOEL MIQUEIAS MAIA / RAFAEL PAIVA ARRUDA / ROMMEL PRATA REGADAS,-,,
Ceará,UECE,BR 51 2023 003235 2,25/10/2023,MonTh: Automated Monitoring of IP Threats,PYTHON,TC-04,PD-01,FUNDAÇÃO UNIVERSIDADE ESTADUAL DO CEARÁ - FUNECE, ARTHUR CORDEIRO URBANO / RAFAEL LOPES GOMES,-,,
Ceará,UECE,BR 51 2023 003232 8,25/10/2023,SoPhiD: Software for Phishing Detection,JAVA SCRIPT / PYTHON,  IF-09/ IF-10/ IN-02," IA-01, PD-01, TC-01",FUNDAÇÃO UNIVERSIDADE ESTADUAL DO CEARÁ - FUNECE, LEONARDO SAMPAIO ROCHA / RHAYANE DA SILVA MONTEIRO,-,,
Ceará,UECE,BR 51 2023 001538 5,02/06/2023,SJud - Sistema de acompanhamento as demandas judiciais de medicamentos e insumos,OUTROS/ PHP,AD-08 / SD-10, GI-06,FUNDAÇÃO UNIVERSIDADE ESTADUAL DO CEARÁ - FUNECE, MARIA SALETE BESSA JORGE / PAULO HENRIQUE MENDES MAIA / SINARA ALVES TOMÁS,-,,
Ceará,UECE,BR 51 2023 001383 8,17/05/2023,IoT-ID: Identificação de Dispositivos IoT usando Dados de Rede Anonimizados,PYTHON,TC-02/ TC-04,"IA-01, PD-01, TI-04",FUNDAÇÃO UNIVERSIDADE ESTADUAL DO CEARÁ - FUNECE, ARIEL LIMA DE CARVALHO PORTELA / RAFAEL DE ALMEIDA MENEZES / RAFAEL LOPES GOMES / WANDERSON LEONARDO COSTA,-,,
Ceará,UECE,BR 51 2023 001380 3,17/05/2023,PPM-Anon: Permutation and Proprieties Maintenance Anonymization,PYTHON,TC-04,PD-01,FUNDAÇÃO UNIVERSIDADE ESTADUAL DO CEARÁ - FUNECE,MATHEUS MONTEIRO SILVEIRA / RAFAEL LOPES GOMES,-,,
Ceará,UECE,BR 51 2023 001372 2,16/05/2023,SSE-DB: Searchable Symmetric Enrcryption for Databases,PYTHON,TC-04,PD-01,FUNDAÇÃO UNIVERSIDADE ESTADUAL DO CEARÁ - FUNECE,DANIELLE DOS SANTOS SILVA / MATHEUS MONTEIRO SILVEIRA / RAFAEL LOPES GOMES,-,,
Ceará,UECE,BR 51 2023 001370 6,16/05/2023,Disfunção erétil no consultório APP, HTML / JAVA SCRIPT / OUTROS / PHP,  SD-03/ SD-05/ SD-08 / SD-09," AP-01, DS-04, TC-01",FUNDAÇÃO UNIVERSIDADE ESTADUAL DO CEARÁ - FUNECE, LUÍS ANTÔNIO LIMA SOLON / MANOEL MIQUEIAS MAIA / ROMMEL PRATA REGADAS / RÔMULO AUGUSTO DA SILVEIRA,-,,
Ceará,UECE,BR 51 2023 001369 2,16/05/2023,www.deltanolab.net,OUTROS,ED-06/ IF-04/ SD-06,"FA-01, GI-01",FUNDAÇÃO UNIVERSIDADE ESTADUAL DO CEARÁ - FUNECE,GILVAN MORAIS NETO LIRA / MARIA SALETE BESSA JORGE / PAULO HENRIQUE MENDES MAIA,-,,
Ceará,UECE,BR 51 2023 000819 2,23/03/2023,Humanizagestor.com_Portal de Implementação da Politica Nacional de Humanização em saúde bucal, JAVA SCRIPT / OUTROS / PHP,SD-02,TC-01,FUNDAÇÃO UNIVERSIDADE ESTADUAL DO CEARÁ - FUNECE,HAROLDO CASTRO DE ALCANTARA / RAQUEL SAMPAIO FLORÊNCIO,-,,
Ceará,UECE,BR 51 2023 000544 4,08/03/2023,eHealthSys Visualização de Dados,JAVA SCRIPT,SD-01/ SD-02/ SD-05/ SD-06,"AV-02, GI-03",FUNDAÇÃO UNIVERSIDADE ESTADUAL DO CEARÁ - FUNECE,DIEGO ALYSSON BRAGA MOREIRA / JOAQUIM CELESTINO JÚNIOR / KÍLVIA LETÍCIA DE ABREU ALMEIDA / LEVY GURGEL CHAVES / MATEUS RODRIGUES LIMA / RAFAEL LOPES GOMES / SAMUEL FAÇANHA CÂMARA / THIAGO PINHO SERPA,-,,
Ceará,UECE,BR 51 2023 000543 6,08/03/2023,eHealthSys Comunicação de Dados,PYTHON,SD-01/ SD-02/ SD-05/ SD-06,"CD-01, GI-08, SO-04",FUNDAÇÃO UNIVERSIDADE ESTADUAL DO CEARÁ - FUNECE,DIEGO ALYSSON BRAGA MOREIRA / JOAQUIM CELESTINO JÚNIOR / KÍLVIA LETÍCIA DE ABREU ALMEIDA / LEVY GURGEL CHAVES / MATEUS RODRIGUES LIMA / RAFAEL LOPES GOMES / SAMUEL FAÇANHA CÂMARA / THIAGO PINHO SERPA,-,,
Ceará,UECE,BR 51 2023 000542 8,08/03/2023,eHealthSys Coleta de Dados,C,SD-01/ SD-02/ SD-05/ SD-06,"CD-04, SO-02, T1-03",FUNDAÇÃO UNIVERSIDADE ESTADUAL DO CEARÁ - FUNECE,DIEGO ALYSSON BRAGA MOREIRA / JOAQUIM CELESTINO JÚNIOR / KÍLVIA LETÍCIA DE ABREU ALMEIDA / LEVY GURGEL CHAVES / MATEUS RODRIGUES LIMA / RAFAEL LOPES GOMES / SAMUEL FAÇANHA CÂMARA / THIAGO PINHO SERPA,-,,
Ceará,UECE,BR 51 2022 002696 1,27/09/2022,MicroMon: Plataforma baseada em Microsserviços para Coleta e Compartilhamento de Medições de Rede,PYTHON, IF-01/ IF-10,"GI-06, GI-08, PD-04",FUNDAÇÃO UNIVERSIDADE ESTADUAL DO CEARÁ - FUNECE,ADRILENE PESSOA DA FONSECA / ARTHUR CORDEIRO URBANO / DENIS MENEZES DE SOUSA / MATHEUS MONTEIRO SILVEIRA / PAULO HENRIQUE MENDES MAIA / RAFAEL LOPES GOMES,-,,
Ceará,UECE,BR 51 2022 002465 9,06/09/2022,PyNetFlow: Uma ferramenta para visualização e análise de tráfego,PYTHON,TC-04,AV-01,FUNDAÇÃO UNIVERSIDADE ESTADUAL DO CEARÁ - FUNECE,LUCAS JOSÉ PEREIRA DE ARAÚJO / RAFAEL LOPES GOMES,-,,
Ceará,UECE,BR 51 2022 002274 5,22/08/2022,UroHPB,CSS / HTML / JAVA SCRIPT / OUTROS,SD-05,AP-01,FUNDAÇÃO UNIVERSIDADE ESTADUAL DO CEARÁ - FUNECE,  BRUNO MOREIRA MAPURUNGA / MANOEL MIQUEIAS MAIA / ROMMEL PRATA REGADAS,-,,
Ceará,UECE,BR 51 2022 002269 9,22/08/2022,Hashing de Dados em Dispositivos IoT de Baixa Capacidade Computacional,C, AD-06 / TC-02/ TC-04,PD-01,FUNDAÇÃO UNIVERSIDADE ESTADUAL DO CEARÁ - FUNECE, EDUARDO ESTEVAM PIMENTEL MOSCA / RAFAEL LOPES GOMES,-,,
Ceará,UECE,BR 51 2022 001318 5,31/05/2022,MIC: Algoritmo de Mitigação da Interferência Cruzada em Ambientes Inteligentes,JAVA, AH-02/ IN-01/ IN-02/ TC-04,FA-01,FUNDAÇÃO UNIVERSIDADE ESTADUAL DO CEARÁ - FUNECE, FRANCISCO ALEXANDRE ARAÚJO ROCHA / RAFAEL LOPES GOMES,-,,
Ceará,UECE,BR 51 2022 001300 2,30/05/2022,SISPRAIA: Sistema Integrado para Gestão Ambiental Pública de Praias,JAVA SCRIPT,AD-02/ AD-04/ MA-01/ MA-02,AV-01,FUNDAÇÃO UNIVERSIDADE ESTADUAL DO CEARÁ - FUNECE,FRANCISCO EDMAR DE SOUSA SILVA PINHEIRO / FÁBIO PERDIGÃO VASCONCELOS / OTÁVIO AUGUSTO DE OLIVEIRA LIMA BARRA,-,,
Ceará,UECE,BR 51 2022 001172 7,18/05/2022,GERIS UTI,OUTROS,SD-05,AP-01,FUNDAÇÃO UNIVERSIDADE ESTADUAL DO CEARÁ - FUNECE,CASSIO PINHEIRO OLIVEIRA / HENRIQUE JORGE MAIA COSTA / HERLENIA DA PENHA OLIVEIRA CAVALCANTE / NEY RÔMULO DE OLIVEIRA PAULA / PAULO IURY PINHEIRO DA ROCHA,-,,
Ceará,UECE,BR 51 2022 000909 9,27/04/2022,LEPEN - Letramento sobre Pé Neuropático, CSS / HTML / PHP,SD-03,GI-01,FUNDAÇÃO UNIVERSIDADE ESTADUAL DO CEARÁ - FUNECE,NATÁLIA AGUIAR MORAES VITORIANO / THEREZA MARIA MAGALHÃES MOREIRA,-,,
Ceará,UECE,BR 51 2022 000650 2,24/03/2022,Gestão - SAE,JAVA SCRIPT,BL-01/ BL-05/ BL-06/ SD-02/ SD-05/ SD-06/ SD-07/ SD-08,"AP-01, FA-01",FUNDAÇÃO UNIVERSIDADE ESTADUAL DO CEARÁ - FUNECE, ADRIANO RODRIGUES DE SOUSA / FRANCISCO JOSÉ DO NASCIMENTO JÚNIOR,-,,
Ceará,UECE,BR 51 2022 000354 6,17/02/2022,App Lean Quality,OUTROS,AD-01,AP-01,FUNDAÇÃO UNIVERSIDADE ESTADUAL DO CEARÁ - FUNECE,FRANCISCO LEON TORRES DE SOUSA / MARIA SALETE BESSA JORGE,-,,
Ceará,UECE,BR 51 2021 003166 0,22/12/2021,Jogo da Memória Frutífero,PYTHON,CO-03/ ED-01/ ED-04,DS-04,FUNDAÇÃO UNIVERSIDADE ESTADUAL DO CEARÁ - FUNECE, ANTÔNIA CHIRLENE EVANGELISTA FERREIRA / CARLIENE JORGE DA SILVA / JOSÉ ROGÉRIO DE OLIVEIRA / MATHEUS COSTA GRANJA / REGINA CLÁUDIA PINHEIRO,-,,
Ceará,UECE,BR 51 2021 003126 1,17/12/2021,App Jogo da Memória Frutífero,JAVA,CO-03/ ED-01/ ED-04,DS-04,FUNDAÇÃO UNIVERSIDADE ESTADUAL DO CEARÁ - FUNECE,ANTÔNIA CHIRLENE EVANGELISTA FERREIRA / CARLIENE JORGE DA SILVA / JOSÉ ROGÉRIO DE OLIVEIRA / MATHEUS COSTA GRANJA / REGINA CLÁUDIA PINHEIRO,-,,
Ceará,UECE,BR 51 2021 002816 3,25/11/2021,LeVoA - Leitura para Voar sem Asas,PYTHON,CO-03/ ED-01/ ED-04,"DS-04, ET-01",FUNDAÇÃO UNIVERSIDADE ESTADUAL DO CEARÁ - FUNECE, ANTÔNIA ALCILÂNEA DE ASSIS OLIVEIRA / ANTÔNIA CHIRLENE EVANGELISTA FERREIRA / ANTÔNIO NILBERTO GONÇALVES DE OLIVEIRA / CARLIENE JORGE DA SILVA / JAMILE MARIA DA COSTA PEDROSA / JOSÉ ROGÉRIO DE OLIVEIRA / MATHEUS COSTA GRANJA / REGINA CLÁUDIA PINHEIRO,-,,
Ceará,UECE,BR 51 2021 001552 5,08/07/2021,AppLeVoA - Aplicativo Leitura para Voar sem Asas,JAVA,CO-03/ ED-01/ ED-04,AP-01,FUNDAÇÃO UNIVERSIDADE ESTADUAL DO CEARÁ - FUNECE, ANTONIO NILBERTO GONÇALVES DE OLIVEIRA / ANTÔNIA ALCILÂNEA DE ASSIS OLIVEIRA / ANTÔNIA CHIRLENE EVANGELISTA FERREIRA / CARLIENE JORGE DA SILVA / JAMILE MARIA DA COSTA PEDROSA / JOSÉ ROGÉRIO DE OLIVEIRA / MATHEUS COSTA GRANJA / REGINA CLÁUDIA PINHEIRO,-,,
Ceará,UECE,BR 51 2021 000604 6,29/03/2021,SysHidronefrose - software para estruturação de laudos de ultrassonografia em pacientes com dilatação do trato urinário,PHP,  SD-08/ SD-09,"FA-01, GI-04",FUNDAÇÃO UNIVERSIDADE ESTADUAL DO CEARÁ - FUNECE,HARLEY SILVEIRA MENEZES / MANOEL MIQUEIAS MAIA / ROMMEL PRATA REGADAS,-,,
Ceará,UECE,BR 51 2021 000307 1,22/02/2021,HANDC - Software para coleta e acompanhamento da motricidade fina de pacientes cirróticos,PHP,SD-06/ SD-08/ SD-09," IA-02, IT-03",FUNDAÇÃO UNIVERSIDADE ESTADUAL DO CEARÁ - FUNECE,CASSIO PINHEIRO OLIVEIRA / FRANCISCO SÉRGIO RANGEL DE PAULA PESSOA / JOSÉ RICARDO DE FIGUEIREDO / MANOEL MIQUEIAS MAIA,-,,
Ceará,UECE,BR 51 2020 002500 5,11/11/2020,SIMON UPA: Sistema de Monitoramento das Unidades de Pronto Atendimento,.NET / CSS / HTML / JAVA SCRIPT,  AD-02/ SD-02,"  AP-03, GI-01",FUNDAÇÃO UNIVERSIDADE ESTADUAL DO CEARÁ - FUNECE, MARIA RAQUEL RODRIGUES CARVALHO / MARIA SALETE BESSA JORGE,-,,
Ceará,UECE,BR 51 2020 002234 0,19/10/2020,Melodiz,JAVA , CO-05/ ED-04/ ED-06/ FQ-02,AP-01,FUNDAÇÃO UNIVERSIDADE ESTADUAL DO CEARÁ - FUNECE,THIAGO DIAS DE CARVALHO QUARESMA GAMA,-,,
Ceará,UECE,BR 51 2020 002212 0,16/10/2020,HELP FERIDAS - TECNOLOGIA M-HEALT PARA PREVENÇÃO E CUIDADOS DE PESSOAS COM FERIDAS,JAVA SCRIPT,  BL-01/ BL-05 / BL-06 / SD-02/ SD-06/ SD-07/ SD-08,"AP-01, FA-01",FUNDAÇÃO UNIVERSIDADE ESTADUAL DO CEARÁ - FUNECE,MARIA CLÁUDIA CARNEIRO PINTO / MARIA SALETE BESSA JORGE,-,,
Ceará,UECE,BR 51 2020 002020 8,28/09/2020,STONEFLUX,JAVA SCRIPT, BL-01 / BL-03 / BL-05 / BL-06 / SD-01 / SD-03 / SD-05 / SD-07 / SD-08,AP-01,FUNDAÇÃO UNIVERSIDADE ESTADUAL DO CEARÁ - FUNECE,  HUMBERTO DE HOLANDA MADEIRA BARROS / MANOEL MIQUEIAS MAIA / ROMMEL PRATA REGADAS,-,,
Ceará,UECE,BR 51 2020 001816 5,04/09/2020,PDE: Predição de Demanda Elástica,R, TC-04," AP-01 , CD-01 , DS-01 , FA-01 , UT-02",FUNDAÇÃO UNIVERSIDADE ESTADUAL DO CEARÁ - FUNECE, DYEGO HENRIQUE LEONEL OLIVEIRA / RAFAEL LOPES GOMES,-,,
Ceará,UECE,BR 51 2020 001794 0,02/09/2020,DAAI: Detecção de Anomalias em Ambientes Inteligentes,PYTHON, TC-04,"AP-01 , CD-01 , CD-05 , CD-06 , DS-01 , FA-01, PD-01",FUNDAÇÃO UNIVERSIDADE ESTADUAL DO CEARÁ - FUNECE, DIEGO ALYSSON MOREIRA / HUMBERTO PIRES MARQUES / RAFAEL LOPES GOMES,-,,
Ceará,UECE,BR 51 2020 001793 2,02/09/2020,HCM: Huffman Compression for Microcontrollers,C, TC-04," AP-01 , CD-01 , DS-01 , FA-01 , UT-02",FUNDAÇÃO UNIVERSIDADE ESTADUAL DO CEARÁ - FUNECE,MARCUS DE VASCONCELOS DIOGO SILVA / RAFAEL LOPES GOMES,-,,
Ceará,UECE,BR 51 2019 002632 2,19/11/2019,Heterogeneous Wireless Channels Assigner,JAVA, AH-02 / IN-01 / IN-02/ TC-04,FA-01,FUNDAÇÃO UNIVERSIDADE ESTADUAL DO CEARÁ - FUNECE, GABRIEL GALDINO DA SILVA / JOAQUIM CELESTINO JÚNIOR / RAFAEL LOPES GOMES,-,,
Ceará,UECE,BR 51 2019 002598 9,14/11/2019,Cardio Health,PYTHON, SD-01 / SD-03 / SD-08,FA-01,FUNDAÇÃO UNIVERSIDADE ESTADUAL DO CEARÁ - FUNECE,  DIEGO ALYSSON BRAGA MOREIRA / JOAQUIM CELESTINO JÚNIOR / RAFAEL LOPES GOMES,-,,
Ceará,UECE,BR 51 2019 001848 6,23/08/2019,BRINCÁLCULO,OUTROS, ED-04, ET-02,FUNDAÇÃO UNIVERSIDADE ESTADUAL DO CEARÁ - FUNECE,AMANDA MARIA DOMINGOS DE OLIVEIRA / DENNYS LEITE MAIA / DILBERTO CHAVES LIMA / FABIANA DE SOUZA MARINHEIRO / GARDNER DE ANDRADE ARRAIS / GUTEMBERG DOS SANTOS CHAVES / ISIS RAMONA MEDEIROS DA CUNHA / JALES ANDERSON DE ASSIS MONTEIRO / JEAN LOPES ORDÉAS NASCIMENTO / KAMILLA DE OLIVEIRA PINHEIRO / MANOEL MESSIAS DE BARROS JUNIOR / MARIA CLARA SOUZA DE FONTES PEREIRA / PRISCILA LAUREN DOS SANTOS LINHARES / RENAN BEZERRA KIMURA / RODOLFO ARAÚJO DE CARVALHO / RODRIGO RODRIGUES MELO DE LIMA,-,,
Ceará,UECE,BR 51 2019 001845 1,23/08/2019,Conta Kg,CSS / HTML / JAVA SCRIPT, ED-04, ET-02,FUNDAÇÃO UNIVERSIDADE ESTADUAL DO CEARÁ - FUNECE,MANDA MARIA DOMINGOS DE OLIVEIRA / CARLOS MATHEUS SOUZA VIANA / DENNYS LEITE MAIA / DÉBORA KAROLINE SILVA DE AZEVEDO / FRANCISCA WELLINGDA LEAL DA SILVA / GABRIEL VIEIRA BARRETO / GARDNER DE ANDRADE ARRAIS / GELLY VIANA MOTA / HAGLIBERTO ALVES DE OLIVEIRA / HENRIQUE MARASCHIN GRANJA / LUCAS DE MEDEIROS FERREIRA / LUÍS EDUARDO ANUNCIADO SILVA / MIKAELLA BARACHO FERREIRA / RAFAELA DE FATIMA SANTOS DA SILVA / SAMUEL DANTAS BATISTA / THAIAN ASSIS DE MORAES,-,,
Ceará,UECE,BR 51 2019 001834 6,22/08/2019,LETRA LIVRE 2.0,JAVA, ED-04, ET-02,FUNDAÇÃO UNIVERSIDADE ESTADUAL DO CEARÁ - FUNECE,AMANDA MARIA DOMINGOS DE OLIVEIRA / DENNYS LEITE MAIA / ISIS RAMONA MEDEIROS DA CUNHA / JOSERLENE LIMA PINHEIRO / JOSÉ VERÍSSIMO DO NASCIMENTO FILHO / JOÃO BATISTA CARVALHO NUNES / MARIA LUCIMARA RODRIGUES DA SILVA CRUZ,-,,
Ceará,UECE,BR 51 2019 001504 5,16/07/2019,Trat-C,CSS / HTML / JAVA SCRIPT,SD-06,FA-01,FUNDAÇÃO UNIVERSIDADE ESTADUAL DO CEARÁ - FUNECE, FRANCISCO SÉRGIO RANGEL DE PAULA PESSOA,-,,
Ceará,UECE,BR 51 2019 001143 0,11/06/2019,Mecanismo online de Criação de Questões: MOCQ,JAVA SCRIPT,ED-03 / ED-06,AP-01,FUNDAÇÃO UNIVERSIDADE ESTADUAL DO CEARÁ - FUNECE, FRANCISCO WKERLYSON PEREIRA BATISTA / IGOR LIMA RODRIGUES / MARIA WILDA FERNANDES FELIPE / WOSLEY MENDES ROCHA,-,,
Ceará,UECE,BR 51 2019 000446 9,14/03/2019,OBAMA - Objetos de Aprendizagem para Matemática,CSS / HTML / JAVA / JAVA SCRIPT, ED-04,FA-01,FUNDAÇÃO UNIVERSIDADE ESTADUAL DO CEARÁ - FUNECE, AMANDA MARIA DOMINGOS DE OLIVEIRA / ANA CLÁUDIA NUNES SILVA / CLÉSIA JORDÂNIA NUNES DA COSTA / DANILO DO CARMO DE SOUZA / DENNYS LEITE MAIA / DÉBORA KAROLINE SILVA DE AZEVEDO / ELVIS MEDEIROS DE MELO / FRANCISCA WELLINGDA LEAL DA SILVA / JOSERLENE LIMA PINHEIRO / MARCILIA CHAGAS BARRETO / MARIA LUZIENE DA SILVA AZEVEDO BANDEIRA / NASSARA MAIA CABRAL CARDOSO GOMES / NELSON ION DE OLIVEIRA / PAULO CÉSAR DA SILVA BATISTA / RODOLFO ARAÚJO DE CARVALHO / RODRIGO RODRIGUES MELO DE LIMA / SAMUEL DANTAS BATISTA,-,,
Ceará,UECE,BR 51 2018 000198 0,16/02/2018,SisAcadPG - Sistema de Gestão Acadêmica para Pós-Graduação,JAVA/ OUTROS,IF-07,"  AP-01, GI-01, SO-01",FUNDAÇÃO UNIVERSIDADE ESTADUAL DO CEARÁ - FUNECE,DIOGO AGUIAR LIMA / GUILHERME LIMA FAÇANHA / MARIELA INÉS CORTES,-,,
Ceará,UECE,BR 51 2017 001163 0,29/08/2017, BE-SYS: SISTEMA E-HEALTH EM BIG-DATA PARA ANÁLISE E DETECÇÃO DE RISCO DE CHOQUE SÉPTICO EM PACIENTES ADULTOS,C++ / JAVA,SD-05,"  AV-01, FA-01", FUNDAÇÃO UNIVERSIDADE ESTADUAL DO CEARÁ, FRANCISCO LEONARDO JALES MARTINS / JOAQUIM CELESTINO JÚNIOR, SAMUEL FAÇANHA CÂMARA,,
Ceará,UECE,BR 51 2017 001159 1,29/08/2017,TPCREATOR - UMA FERRAMENTA PARA CRIAÇÃO DE TOPOLOGIA NO OPEN STACK,JAVA/ PYTHON, TC-04,"  CD-05 , SM-01",FUNDAÇÃO UNIVERSIDADE ESTADUAL DO CEARÁ - FUNECE,   BRUNO LOPES ALCÂNTARA BATISTA / FILIPE FERANDES DOS SANTOS BRASIL DE MATOS / JOAQUIM CELESTINO JÚNIOR / JOÃO GONÇALVES FILHO, SAMUEL FAÇANHA CÂMARA,,
Ceará,UECE,BR 51 2017 001161 3,29/08/2017,SONA: ARQUITETURA PARA FATIAMENTO DE REDES ÓPTICAS DEFINIDAS POR SOFTWARE,JAVA, TC-04,CD-05,FUNDAÇÃO UNIVERSIDADE ESTADUAL DO CEARÁ - FUNECE, JOAQUIM CELESTINO JÚNIOR / TIAGO PORTELA DE SOUZA, SAMUEL FAÇANHA CÂMARA,,
Ceará,UECE,BR 51 2017 001162 1,29/08/2017,SIMTOPOLOGY: UM SIMULADOR DE REDE PARA TESTES DE PROTOCOLOS,C, TC-04," SM-01 , TI-01",FUNDAÇÃO UNIVERSIDADE ESTADUAL DO CEARÁ - FUNECE, DANIEL SUCUPIRA LIMA / FILIPE FERANDES DOS SANTOS BRASIL DE MATOS / FÁBIO DE SOUZA CERQUEIRA / JOAQUIM CELESTINO JÚNIOR / JOSÉ HENRIQUE BRANDAO NETO / JOÃO GONÇALVES FILHO / MANUEL RUI PESSOA DE PAULA / SILVIO ROBERTO MARTINS AMARANTE, SAMUEL FAÇANHA CÂMARA,,
Ceará,UECE,BR 51 2017 001160 5,29/08/2017,MIB YANG DO OTN-SWITCH, UML / YANG, TC-04,"CD-05 , CD-05",FUNDAÇÃO UNIVERSIDADE ESTADUAL DO CEARÁ - FUNECE, JEFFERSON GOMES DE ALCÂNTARA / JOAQUIM CELESTINO JÚNIOR, SAMUEL FAÇANHA CÂMARA,,
Ceará,UECE,BR 51 2017 000815 9,06/07/2017,SOMATOCALC,JAVA,SD-01," AP-01 , AV-01, FA-01",FUNDAÇÃO UNIVERSIDADE ESTADUAL DO CEARÁ - FUNECE,ANDRÉ ACCIOLLY NOGUEIRA MACHADO / ANDRÉ ALVES MAIA / CHRISTINA PACHECO SANTOS MARTIN / FRANCISCO SERGIO LOPES VASCONCELOS FILHO / JOÃO FILHO FREIRE LOPES / PAULA MATIAS SOARES / ROBERTA CRISTINA DA ROCHA E SILVA / WELTON DANIEL NOGUEIRA GODINHO, SAMUEL FAÇANHA CÂMARA,,
Ceará,UECE,BR 51 2016 001737 6,16/12/2016,UP SOFTWARE,ACESS,SD-02 / SD-03/ SD-05 / SD-06/ SD-09," AP-01 , FA-04 , GI-01 , SO-02 , SO-05",FUNDAÇÃO UNIVERSIDADE ESTADUAL DO CEARÁ - FUNECE,JOÃO PAULO CAMELO MENEZES, SAMUEL FAÇANHA CÂMARA,,
Ceará,UECE,BR 51 2015 001227 4,28/10/2015,APP DNAQUIZ: RECURSO DIDÁTICO PARA O ENSINO DE BIOLOGIA MOLECULAR,ADT, BL-01/ BL-02 / BL-03 / BL-07/ ED-04,"  AP-01 , GI-05 , TC-01",FUNDAÇÃO UNIVERSIDADE ESTADUAL DO CEARÁ - FUNECE, CHRISTINA PACHECO SANTOS MARTIN / JULIANA OSÓRIO ALVES / LUCAS LIMA VIEIRA / PAULA MATIAS SOARES / STELA MIRLA DA SILVA FELIPE / VÂNIA MARILANDE CECCATTO / ÂNGELO FILIPE DO AMARAL ACÁCIO, SAMUEL FAÇANHA CÂMARA,,
Ceará,UECE,BR 51 2015 001228 2,28/10/2015,GENE COLLECTOR,JAVA, BL-01 / BL-02 / BL-03 / BL-07 / ED-04,"AP-01 , GI-05 , TC-01",FUNDAÇÃO UNIVERSIDADE ESTADUAL DO CEARÁ - FUNECE, ANTONIO ALMIR ARAUJO NETO / CHRISTINA PACHECO SANTOS MARTIN / JHONY LUCAS CAVALCANTE DA SILVA / JULIANA OSÓRIO ALVES / MILCA MAGALHÃES DIAS DE CARVALHO SOARES / RENATO PEDROSA VASCONCELOS / SAMUEL GONÇALVES LOPES / STELA MIRLA DA SILVA FELIPE / VÂNIA MARILANDE CECCATTO / WILLYANE DE PAIVA SILVA, SAMUEL FAÇANHA CÂMARA,,
Ceará,UECE,BR 51 2015 001113 8,01/10/2015,SISTEMA CASULO- GESTÃO DE INCUBADORAS,JAVA, AD-02 / AD-05 / AD-11 / EC-14 / IF-10,"  AP-02 , AP-03 , AV-01 , SO-07 , TC-01",FUNDAÇÃO UNIVERSIDADE ESTADUAL DO CEARÁ - FUNECE, DANIEL DUARTE PONTES / JULIANA DOS SANTOS ANDRADE / MARIA JOSÉ BARBOSA GOMES / MARIANA CHAVES ANTENOR,-,,
Ceará,UECE,BR 51 2015 001112 0,01/10/2015,SISTEMA DE EVENTOS - SISEVENTOS, JAVA EE 1.6, AD-01 / AD-02 / AD-04,"AT-06 , ET-01 , GI-01 , TC-01",FUNDAÇÃO UNIVERSIDADE ESTADUAL DO CEARÁ - FUNECE, LUANNA ALVES FALCÃO / MARIA WILDA FERNANDES FELIPE / PABLO BRUNO DE MOURA NÓBREGA, SAMUEL FAÇANHA CÂMARA,,
